GEO.id,GEO.id2,GEO.display-label,HC01_EST_VC01,HC01_MOE_VC01,HC02_EST_VC01,HC02_MOE_VC01,HC03_EST_VC01,HC03_MOE_VC01,HC04_EST_VC01,HC04_MOE_VC01,HC01_EST_VC02,HC01_MOE_VC02,HC02_EST_VC02,HC02_MOE_VC02,HC03_EST_VC02,HC03_MOE_VC02,HC04_EST_VC02,HC04_MOE_VC02,HC01_EST_VC03,HC01_MOE_VC03,HC02_EST_VC03,HC02_MOE_VC03,HC03_EST_VC03,HC03_MOE_VC03,HC04_EST_VC03,HC04_MOE_VC03,HC01_EST_VC04,HC01_MOE_VC04,HC02_EST_VC04,HC02_MOE_VC04,HC03_EST_VC04,HC03_MOE_VC04,HC04_EST_VC04,HC04_MOE_VC04,HC01_EST_VC05,HC01_MOE_VC05,HC02_EST_VC05,HC02_MOE_VC05,HC03_EST_VC05,HC03_MOE_VC05,HC04_EST_VC05,HC04_MOE_VC05,HC01_EST_VC06,HC01_MOE_VC06,HC02_EST_VC06,HC02_MOE_VC06,HC03_EST_VC06,HC03_MOE_VC06,HC04_EST_VC06,HC04_MOE_VC06,HC01_EST_VC07,HC01_MOE_VC07,HC02_EST_VC07,HC02_MOE_VC07,HC03_EST_VC07,HC03_MOE_VC07,HC04_EST_VC07,HC04_MOE_VC07,HC01_EST_VC08,HC01_MOE_VC08,HC02_EST_VC08,HC02_MOE_VC08,HC03_EST_VC08,HC03_MOE_VC08,HC04_EST_VC08,HC04_MOE_VC08,HC01_EST_VC09,HC01_MOE_VC09,HC02_EST_VC09,HC02_MOE_VC09,HC03_EST_VC09,HC03_MOE_VC09,HC04_EST_VC09,HC04_MOE_VC09,HC01_EST_VC10,HC01_MOE_VC10,HC02_EST_VC10,HC02_MOE_VC10,HC03_EST_VC10,HC03_MOE_VC10,HC04_EST_VC10,HC04_MOE_VC10,HC01_EST_VC11,HC01_MOE_VC11,HC02_EST_VC11,HC02_MOE_VC11,HC03_EST_VC11,HC03_MOE_VC11,HC04_EST_VC11,HC04_MOE_VC11,HC01_EST_VC13,HC01_MOE_VC13,HC02_EST_VC13,HC02_MOE_VC13,HC03_EST_VC13,HC03_MOE_VC13,HC04_EST_VC13,HC04_MOE_VC13,HC01_EST_VC15,HC01_MOE_VC15,HC02_EST_VC15,HC02_MOE_VC15,HC03_EST_VC15,HC03_MOE_VC15,HC04_EST_VC15,HC04_MOE_VC15,HC01_EST_VC18,HC01_MOE_VC18,HC02_EST_VC18,HC02_MOE_VC18,HC03_EST_VC18,HC03_MOE_VC18,HC04_EST_VC18,HC04_MOE_VC18,HC01_EST_VC19,HC01_MOE_VC19,HC02_EST_VC19,HC02_MOE_VC19,HC03_EST_VC19,HC03_MOE_VC19,HC04_EST_VC19,HC04_MOE_VC19,HC01_EST_VC20,HC01_MOE_VC20,HC02_EST_VC20,HC02_MOE_VC20,HC03_EST_VC20,HC03_MOE_VC20,HC04_EST_VC20,HC04_MOE_VC20
Id,Id2,Geography,Households; Estimate; Total,Households; Margin of Error; Total,Families; Estimate; Total,Families; Margin of Error; Total,Married-couple families; Estimate; Total,Married-couple families; Margin of Error; Total,Nonfamily households; Estimate; Total,Nonfamily households; Margin of Error; Total,"Households; Estimate; Less than $10,000","Households; Margin of Error; Less than $10,000","Families; Estimate; Less than $10,000","Families; Margin of Error; Less than $10,000","Married-couple families; Estimate; Less than $10,000","Married-couple families; Margin of Error; Less than $10,000","Nonfamily households; Estimate; Less than $10,000","Nonfamily households; Margin of Error; Less than $10,000","Households; Estimate; $10,000 to $14,999","Households; Margin of Error; $10,000 to $14,999","Families; Estimate; $10,000 to $14,999","Families; Margin of Error; $10,000 to $14,999","Married-couple families; Estimate; $10,000 to $14,999","Married-couple families; Margin of Error; $10,000 to $14,999","Nonfamily households; Estimate; $10,000 to $14,999","Nonfamily households; Margin of Error; $10,000 to $14,999","Households; Estimate; $15,000 to $24,999","Households; Margin of Error; $15,000 to $24,999","Families; Estimate; $15,000 to $24,999","Families; Margin of Error; $15,000 to $24,999","Married-couple families; Estimate; $15,000 to $24,999","Married-couple families; Margin of Error; $15,000 to $24,999","Nonfamily households; Estimate; $15,000 to $24,999","Nonfamily households; Margin of Error; $15,000 to $24,999","Households; Estimate; $25,000 to $34,999","Households; Margin of Error; $25,000 to $34,999","Families; Estimate; $25,000 to $34,999","Families; Margin of Error; $25,000 to $34,999","Married-couple families; Estimate; $25,000 to $34,999","Married-couple families; Margin of Error; $25,000 to $34,999","Nonfamily households; Estimate; $25,000 to $34,999","Nonfamily households; Margin of Error; $25,000 to $34,999","Households; Estimate; $35,000 to $49,999","Households; Margin of Error; $35,000 to $49,999","Families; Estimate; $35,000 to $49,999","Families; Margin of Error; $35,000 to $49,999","Married-couple families; Estimate; $35,000 to $49,999","Married-couple families; Margin of Error; $35,000 to $49,999","Nonfamily households; Estimate; $35,000 to $49,999","Nonfamily households; Margin of Error; $35,000 to $49,999","Households; Estimate; $50,000 to $74,999","Households; Margin of Error; $50,000 to $74,999","Families; Estimate; $50,000 to $74,999","Families; Margin of Error; $50,000 to $74,999","Married-couple families; Estimate; $50,000 to $74,999","Married-couple families; Margin of Error; $50,000 to $74,999","Nonfamily households; Estimate; $50,000 to $74,999","Nonfamily households; Margin of Error; $50,000 to $74,999","Households; Estimate; $75,000 to $99,999","Households; Margin of Error; $75,000 to $99,999","Families; Estimate; $75,000 to $99,999","Families; Margin of Error; $75,000 to $99,999","Married-couple families; Estimate; $75,000 to $99,999","Married-couple families; Margin of Error; $75,000 to $99,999","Nonfamily households; Estimate; $75,000 to $99,999","Nonfamily households; Margin of Error; $75,000 to $99,999","Households; Estimate; $100,000 to $149,999","Households; Margin of Error; $100,000 to $149,999","Families; Estimate; $100,000 to $149,999","Families; Margin of Error; $100,000 to $149,999","Married-couple families; Estimate; $100,000 to $149,999","Married-couple families; Margin of Error; $100,000 to $149,999","Nonfamily households; Estimate; $100,000 to $149,999","Nonfamily households; Margin of Error; $100,000 to $149,999","Households; Estimate; $150,000 to $199,999","Households; Margin of Error; $150,000 to $199,999","Families; Estimate; $150,000 to $199,999","Families; Margin of Error; $150,000 to $199,999","Married-couple families; Estimate; $150,000 to $199,999","Married-couple families; Margin of Error; $150,000 to $199,999","Nonfamily households; Estimate; $150,000 to $199,999","Nonfamily households; Margin of Error; $150,000 to $199,999","Households; Estimate; $200,000 or more","Households; Margin of Error; $200,000 or more","Families; Estimate; $200,000 or more","Families; Margin of Error; $200,000 or more","Married-couple families; Estimate; $200,000 or more","Married-couple families; Margin of Error; $200,000 or more","Nonfamily households; Estimate; $200,000 or more","Nonfamily households; Margin of Error; $200,000 or more",Households; Estimate; Median income (dollars),Households; Margin of Error; Median income (dollars),Families; Estimate; Median income (dollars),Families; Margin of Error; Median income (dollars),Married-couple families; Estimate; Median income (dollars),Married-couple families; Margin of Error; Median income (dollars),Nonfamily households; Estimate; Median income (dollars),Nonfamily households; Margin of Error; Median income (dollars),Households; Estimate; Mean income (dollars),Households; Margin of Error; Mean income (dollars),Families; Estimate; Mean income (dollars),Families; Margin of Error; Mean income (dollars),Married-couple families; Estimate; Mean income (dollars),Married-couple families; Margin of Error; Mean income (dollars),Nonfamily households; Estimate; Mean income (dollars),Nonfamily households; Margin of Error; Mean income (dollars),Households; Estimate; PERCENT IMPUTED - Household income in the past 12 months,Households; Margin of Error; PERCENT IMPUTED - Household income in the past 12 months,Families; Estimate; PERCENT IMPUTED - Household income in the past 12 months,Families; Margin of Error; PERCENT IMPUTED - Household income in the past 12 months,Married-couple families; Estimate; PERCENT IMPUTED - Household income in the past 12 months,Married-couple families; Margin of Error; PERCENT IMPUTED - Household income in the past 12 months,Nonfamily households; Estimate; PERCENT IMPUTED - Household income in the past 12 months,Nonfamily households; Margin of Error; PERCENT IMPUTED - Household income in the past 12 months,Households; Estimate; PERCENT IMPUTED - Family income in the past 12 months,Households; Margin of Error; PERCENT IMPUTED - Family income in the past 12 months,Families; Estimate; PERCENT IMPUTED - Family income in the past 12 months,Families; Margin of Error; PERCENT IMPUTED - Family income in the past 12 months,Married-couple families; Estimate; PERCENT IMPUTED - Family income in the past 12 months,Married-couple families; Margin of Error; PERCENT IMPUTED - Family income in the past 12 months,Nonfamily households; Estimate; PERCENT IMPUTED - Family income in the past 12 months,Nonfamily households; Margin of Error; PERCENT IMPUTED - Family income in the past 12 months,Households; Estimate; PERCENT IMPUTED - Nonfamily income in the past 12 months,Households; Margin of Error; PERCENT IMPUTED - Nonfamily income in the past 12 months,Families; Estimate; PERCENT IMPUTED - Nonfamily income in the past 12 months,Families; Margin of Error; PERCENT IMPUTED - Nonfamily income in the past 12 months,Married-couple families; Estimate; PERCENT IMPUTED - Nonfamily income in the past 12 months,Married-couple families; Margin of Error; PERCENT IMPUTED - Nonfamily income in the past 12 months,Nonfamily households; Estimate; PERCENT IMPUTED - Nonfamily income in the past 12 months,Nonfamily households; Margin of Error; PERCENT IMPUTED - Nonfamily income in the past 12 months
0500000US36005,36005,"Bronx County, New York",472464,1797,310610,2101,128727,1897,161854,2156,16.6,0.4,12.7,0.4,3.0,0.3,26.5,0.7,8.8,0.3,7.8,0.4,3.8,0.4,11.3,0.6,13.9,0.4,14.0,0.4,10.0,0.6,14.3,0.6,11.4,0.4,11.7,0.5,9.6,0.6,11.5,0.6,14.1,0.4,14.7,0.5,14.9,0.7,12.9,0.5,15.8,0.4,16.3,0.5,20.9,0.9,13.5,0.6,8.8,0.3,9.9,0.4,14.7,0.6,5.6,0.4,7.3,0.2,8.8,0.3,15.3,0.7,3.2,0.3,2.0,0.2,2.5,0.2,4.8,0.4,0.7,0.2,1.2,0.1,1.5,0.1,3.1,0.3,0.4,0.1,34264,474,38431,684,58739,1174,22863,801,47325,477,52161,658,73674,1248,33944,545,31.1,(X),(X),(X),(X),(X),(X),(X),(X),(X),33.2,(X),(X),(X),(X),(X),(X),(X),(X),(X),(X),(X),24.9,(X)
0500000US36047,36047,"Kings County, New York",903991,2532,581345,3562,341747,3027,322646,3078,12.5,0.2,8.6,0.3,3.7,0.2,21.1,0.5,7.1,0.2,6.2,0.2,5.4,0.3,9.0,0.3,11.6,0.2,11.1,0.3,9.1,0.4,12.9,0.4,10.6,0.3,11.1,0.3,9.8,0.4,10.4,0.4,13.4,0.3,14.0,0.4,13.2,0.4,12.2,0.4,16.4,0.3,17.0,0.3,17.7,0.4,14.9,0.5,10.4,0.2,11.2,0.3,13.0,0.4,8.3,0.4,10.5,0.2,12.0,0.3,15.3,0.4,7.0,0.3,3.9,0.1,4.6,0.2,6.5,0.3,2.2,0.2,3.6,0.1,4.3,0.2,6.4,0.3,2.0,0.2,43567,444,48777,600,61158,827,31250,453,62656,523,69252,742,84616,1064,47353,617,38.0,(X),(X),(X),(X),(X),(X),(X),(X),(X),40.8,(X),(X),(X),(X),(X),(X),(X),(X),(X),(X),(X),31.4,(X)
0500000US36061,36061,"New York County, New York",732204,3587,300147,3093,190972,2650,432057,3780,10.4,0.3,6.8,0.4,2.3,0.3,13.1,0.4,5.6,0.2,4.8,0.3,2.6,0.2,6.2,0.3,8.6,0.3,9.4,0.4,5.7,0.3,8.2,0.3,7.3,0.2,7.6,0.3,4.8,0.3,7.2,0.3,9.5,0.3,9.6,0.5,7.0,0.5,9.6,0.4,13.6,0.3,11.5,0.4,10.2,0.5,15.0,0.4,9.9,0.3,8.1,0.3,8.3,0.4,10.8,0.4,12.7,0.3,11.8,0.4,15.1,0.6,13.1,0.5,6.8,0.2,7.3,0.3,10.0,0.5,6.3,0.3,15.8,0.3,23.0,0.5,34.0,0.8,10.5,0.3,64971,675,75629,1280,126641,3032,58269,1024,122620,1358,161893,2826,222672,4511,94121,1304,26.5,(X),(X),(X),(X),(X),(X),(X),(X),(X),31.2,(X),(X),(X),(X),(X),(X),(X),(X),(X),(X),(X),22.7,(X)
0500000US36081,36081,"Queens County, New York",774311,2026,527510,3522,350286,3414,246801,3008,6.9,0.2,4.3,0.2,2.2,0.2,13.6,0.5,4.8,0.2,3.5,0.2,2.8,0.2,8.2,0.3,9.8,0.2,8.5,0.2,7.2,0.3,13.6,0.5,10.1,0.2,9.8,0.3,8.9,0.3,11.5,0.5,13.6,0.3,13.6,0.4,12.4,0.5,14.3,0.6,19.3,0.4,19.5,0.4,19.1,0.5,18.2,0.6,13.3,0.3,14.6,0.3,15.7,0.4,9.9,0.5,13.7,0.2,16.0,0.3,18.8,0.4,7.5,0.4,5.0,0.1,6.0,0.2,7.5,0.3,2.0,0.2,3.5,0.1,4.3,0.2,5.5,0.2,1.2,0.2,55291,482,62459,598,71419,632,38032,912,70208,495,77569,661,86864,860,49411,761,39.0,(X),(X),(X),(X),(X),(X),(X),(X),(X),40.9,(X),(X),(X),(X),(X),(X),(X),(X),(X),(X),(X),31.9,(X)
0500000US36085,36085,"Richmond County, New York",164279,1066,122677,1322,92319,1307,41602,1380,6.4,0.5,4.1,0.5,1.4,0.3,14.7,1.2,3.8,0.4,2.3,0.4,1.8,0.3,8.4,0.9,7.7,0.4,5.3,0.5,4.1,0.5,14.8,1.3,7.5,0.4,6.5,0.4,5.1,0.5,11.1,1.1,10.1,0.5,9.2,0.6,7.6,0.6,13.3,1.2,16.9,0.7,17.2,0.9,16.6,1.0,15.9,1.4,14.6,0.6,15.9,0.7,16.8,0.9,10.6,1.0,18.1,0.6,21.3,0.8,24.5,1.0,7.3,0.9,8.8,0.5,10.7,0.7,13.0,0.8,2.4,0.5,6.1,0.3,7.5,0.4,9.1,0.6,1.4,0.4,71084,1130,83264,1389,94277,1491,35805,1348,86604,1048,97854,1317,109437,1624,49140,1646,37.4,(X),(X),(X),(X),(X),(X),(X),(X),(X),38.7,(X),(X),(X),(X),(X),(X),(X),(X),(X),(X),(X),31.4,(X)
